id,common_name,vietnamese_name,scientific_name,bird_order,family,description,distribution,diet,conservation_status
1,Abbott's Babbler,Chim Tòng quạ,Malacocincla abbotti,Passeriformes - Bộ Sẻ,"Pellorneidae - Họ Chuối tiêu
","Abbott's Babbler là một loài chim nhỏ thuộc họ Pellorneidae. Chim có kích thước trung bình từ 16 đến 18 cm. Chim trưởng thành có lưng và đầu màu nâu xám, bụng và ngực màu trắng với vạch nâu sẫm. Chim non có màu sắc tương tự nhưng màu sắc của chúng mờ hơn. Loài này có tiếng kêu đặc trưng là tiếng kêu kết hợp giữa tiếng hót và tiếng tru trầm.",Abbott's Babbler sinh sống trong rừng nhiệt đới và rừng thưa ở miền nam Lào và miền bắc Thái Lan. Chúng sống ẩn náu trong bụi cây và thường đi cặp hoặc nhóm nhỏ. ,Abbott's Babbler thức ăn chủ yếu là côn trùng và sâu bọ.,Near Threatened - Gần bị đe doạ
2,Abbott's Booby,Cò biển Abbott,Sula abbotti,Suliformes - Bộ Chim điên,Sulidae - Họ Cò biển,"Abbott's Booby là một loài chim biển lớn thuộc họ Sulidae. Chim có kích thước trung bình từ 71 đến 76 cm, với sải cánh khoảng 140 cm. Chim trưởng thành có lông màu trắng và đầu màu xám. Chim cái thường có lông vàng hoặc nâu nhạt trên đầu. Chúng có mỏ dài và chóp mỏ xanh. ","Loài này sống chủ yếu trên các đảo và hòn đá xa bờ biển, xây tổ trên các cành cây hoặc trên mặt đất. ",Abbott's Booby chủ yếu ăn cá và mực.,Near Threatened - Gần bị đe doạ
3,Abyssinian Ground Hornbill,Chim đầu bò Abyssinian,Bucorvus abyssinicus,Bucerotiformes - Bộ Mỏ Sừng,Bucerotidae - Họ Mỏ Sừng,"Abyssinian Ground Hornbill là một loài chim lớn thuộc họ Bucerotidae. Chim đực có kích thước lớn hơn chim cái, đạt chiều dài từ 90 đến 100 cm và cân nặng khoảng 2-4 kg. Lông của chúng có màu đen với các vạch trắng ở cánh và đuôi. Chim có mỏ lớn và mạnh, với một góc cong xuống. Mỏ chim đực có màu đỏ, trong khi mỏ chim cái có màu xanh.","
Abyssinian Ground Hornbill sinh sống chủ yếu trong các khu rừng, đồng cỏ và vùng đồng cỏ cây bụi ở Đông Phi, bao gồm các quốc gia như Ethiopia, Kenya, Somalia và Sudan. Chúng thường di chuyển theo nhóm.","Abyssinian Ground Hornbill ăn đa dạng thức ăn bao gồm côn trùng, động vật nhỏ, thực vật và trái cây.",Vulnerable - Bị đe dọa
4,African Crowned Crane,Sếu đầu hoàng,Balearica pavonina,Gruiformes - Bộ Sếu,Gruidae - Họ Sếu,"African Crowned Crane là một loài chim lớn thuộc họ Gruidae. Chim có kích thước trung bình từ 100 đến 120 cm và cân nặng khoảng 3-6 kg. Chim đực và chim cái có ngoại hình tương đối giống nhau. Đặc điểm nổi bật của chim là một mũi lông đầy màu sắc ở đỉnh đầu, tạo thành vương miện (crown) đặc trưng, với màu vàng, đỏ và trắng. Lông cánh của chúng có màu đen và trắng, tạo thành một họa tiết thú vị khi bay. Chim có mỏ dài và mảng da trước mắt màu đỏ.","African Crowned Crane sinh sống chủ yếu trong các vùng cỏ ngập nước, đầm lầy và cánh đồng ở châu Phi. ","Chúng ăn đa dạng thức ăn, bao gồm cỏ, hạt, côn trùng, động vật nhỏ và động vật thủy sinh.",Vulnerable - Bị đe dọa
5,African Emerald Cuckoo,Chim Cu cu xanh châu Phi,Chrysococcyx cupreus,Cuculiformes - Bộ Cu Cu,Cuculidae - Họ Cu Cu,"African Emerald Cuckoo là một loài chim nhỏ thuộc họ Cuculidae. Chim có kích thước trung bình từ 17 đến 20 cm. Chim đực và chim cái có ngoại hình khác nhau. Chim đực có lông màu xanh lá cây chói lọi trên lưng, cổ và ngực, trong khi chim cái có lông màu nâu nhạt và sọc trắng trên cánh. Cả hai giới đều có mỏ nhọn và màu đen.","African Emerald Cuckoo sinh sống trong các khu rừng, cánh đồng và khu vực cây bụi ở châu Phi. ","Chúng ăn chủ yếu các loại côn trùng, bao gồm bướm, con nhộng và kiến.",
6,African Firefinch,Chim chích lửa châu Phi,Lagonosticta rubricata,Passeriformes - Bộ Sẻ,Estrildidae - Họ Chim di,"African Firefinch là một loài chim nhỏ thuộc họ Estrildidae. Chim đực và chim cái có ngoại hình khác nhau. Chim đực có lưng màu xám xanh đậm hoặc nâu, đầu và ngực màu đỏ sáng, cánh và đuôi đen. Chim cái có màu nâu nhạt trên lưng và màu đỏ nhạt trên đầu và ngực. Cả hai giới đều có mỏ nhọn và màu đen.","African Firefinch phân bố rộng khắp châu Phi, từ khu vực Sahara đến Nam Phi. Chúng thích nghi với các môi trường sống khác nhau như cánh đồng, vùng bãi cỏ, cánh đồng lúa mì và khu vực cây bụi.",Chim ăn chủ yếu hạt và côn trùng nhỏ.,
7,African Oystercatcher,Sếu cắt hàu châu Phi,Haematopus moquini,Charadriiformes - Bộ Cun cút,Haematopodidae,"African Oystercatcher là một loài chim lớn thuộc họ Haematopodidae. Chim có kích thước trung bình từ 42 đến 48 cm và cân nặng khoảng 500-700 gram. Chim có lông màu đen sậm, mỏ dài, đen và chân màu hồng. Chim đực và chim cái có ngoại hình tương đối giống nhau.","African Oystercatcher sinh sống chủ yếu ở khu vực bờ biển của Nam Phi, từ Namibia đến Nam Phi. Chúng thường tìm thức ăn trên bãi cát, đá biển và khu vực ven biển. ","Chim ăn chủ yếu các loài hàu, sò và các loài động vật thủy sinh nhỏ khác.",Near Threatened - Gần bị đe doạ
8,African Pied Hornbill,Chim nòng cổ châu Phi,Tockus fasciatus,Bucerotiformes - Bộ Mỏ Sừng,Bucerotidae - Họ Mỏ Sừng,"African Pied Hornbill là một loài chim vừa, có kích thước trung bình từ 40 đến 55 cm. Chim có lông màu đen và trắng, với lưng và cánh màu đen và bụng màu trắng. Chim đực và chim cái có ngoại hình tương đối giống nhau, nhưng chim đực có mỏ dài hơn và màu sáng hơn chim cái.","African Pied Hornbill sinh sống chủ yếu trong khu rừng, cánh đồng và vùng cây bụi ở châu Phi.","Chúng ăn chủ yếu các loại quả, hạt, côn trùng và động vật nhỏ.",
9,African Pygmy Goose,Vịt nhỏ châu Phi,Nettapus auritus,Anseriformes - Bộ Ngỗng,Anatidae - Họ Vịt,"African Pygmy Goose là một loài chim vịt nhỏ, có kích thước trung bình khoảng 30 cm. Chim đực và chim cái có ngoại hình tương đối giống nhau. Lông của chúng có màu xám xanh nhạt trên lưng và màu trắng trên bụng. Mỏ và chân của chim có màu đỏ.","African Pygmy Goose phân bố rộng khắp ở châu Phi, từ vùng Sahara đến miền nam châu Phi. Chúng thích nghi với các môi trường sống như đầm lầy, ao rừng và khu vực có nước ngọt. ","Chim ăn chủ yếu các loại thực vật thủy sinh như lá non, hạt và côn trùng nước.",
10,Albatross,Chim hải âu,Albatross,Procellariiformes - Bộ Hải Âu,Diomedeidae - Họ Hải âu mày đen,"Albatross là một nhóm chim biển lớn thuộc họ Diomedeidae. Chúng có kích thước lớn, với sải cánh có thể lên đến 3,7 mét, là sải cánh lớn nhất trong tất cả các loài chim. Albatross có lông màu trắng hoặc xám với đặc điểm là cánh dài và sắc nhọn, đuôi hình chữ V. Mỏ của chúng dài và hình nón, thích hợp để họ tiếp xúc với nước.",Albatross sống chủ yếu trên biển và có khả năng bay xa và kéo dài trong thời gian dài mà không cần nghỉ. ,"Chúng thức ăn chủ yếu là cá, mực, và các sinh vật biển nhỏ.",
11,Abert's Towhee,Chim gõ kiến Abert,Melozone aberti,Passeriformes - Bộ Sẻ,Passerellidae - Họ Sẻ Tân Thế giới,"Abert's Towhee là một loài chim thuộc họ Passerellidae. Chim có kích thước trung bình, khoảng 20-23 cm. Chim đực và chim cái có ngoại hình tương đối giống nhau, với lông màu nâu đỏ phía trên và màu trắng phía dưới. Chim có mỏ lớn, đen và chân màu hồng.","Abert's Towhee sinh sống chủ yếu ở miền Tây Hoa Kỳ và miền Bắc Mexico. Chúng thích nghi với các môi trường sống như rừng cây bụi, vùng cây cỏ và khu rừng sồi. ","Chim thường tìm thức ăn trên mặt đất, ăn các loại hạt, côn trùng và sâu bọ.",Least Concern - Ít quan tâm
12,Alexandrine Parakeet,Vẹt Alexandrine,Psittacula eupatria,Psittaciformes - Bộ Vẹt,Psittaculidae - Họ Vẹt,"Alexandrine Parakeet là một loài chim vẹt thuộc họ Psittaculidae. Chim đực và chim cái có ngoại hình tương đối giống nhau, với lông màu xanh lục đậm phía trên và màu xám phía dưới. Đặc điểm đặc trưng của chim là cổ dài và mỏ mạnh.","Alexandrine Parakeet có phân bố rộng khắp ở khu vực Ấn Độ, Nepal, Sri Lanka và các vùng lân cận. Chúng sống chủ yếu trong rừng nhiệt đới, khu vườn và các vùng nông thôn. ","Chim ăn chủ yếu các loại trái cây, hạt, mầm và cây cỏ.",Least Concern - Ít quan tâm
13,Alpine Chough,Quạ đen Alp,Pyrrhocorax graculus,Passeriformes - Bộ Sẻ,Corvidae - Họ Quạ,"Alpine Chough là một loài chim trong họ Corvidae. Chúng có kích thước trung bình, khoảng 35-39 cm. Chim đực và chim cái có ngoại hình tương đối giống nhau, với lông màu đen toàn bộ và mỏ và chân màu đỏ. Đặc điểm nổi bật của chúng là cánh dài và đuôi hình vuông.","Alpine Chough sinh sống chủ yếu ở vùng núi cao của châu Âu, bao gồm cả dãy Alps. Chúng thích nghi với môi trường đá và băng tuyết, thường tìm thức ăn trên mặt đất. ","Chim ăn chủ yếu các loại côn trùng, mồng tơi và hạt cây.",Least Concern - Ít quan tâm
14,Altamira Yellowthroat,Chim họng vàng Altamira,Geothlypis flavovelata,Passeriformes - Bộ Sẻ,Parulidae,"Altamira Yellowthroat là một loài chim thuộc họ Parulidae. Chim đực và chim cái có ngoại hình khác nhau. Chim đực có lông màu vàng rực, đầu màu đen và có một vệt màu đen đi qua mắt. Chim cái có lông màu nâu với các vệt vàng trên ngực và bụng.","Altamira Yellowthroat là loài chim phân bố chủ yếu ở Mexico và một số khu vực ở Texas, Hoa Kỳ. Chúng sống trong các khu vực đầm lầy, bãi cát và vùng đồng cỏ. ",Chim ăn chủ yếu côn trùng và các loại hạt.,Least Concern - Ít quan tâm
15,American Avocet,,Recurvirostra americana,Charadriiformes - Bộ Cun cút,Recurvirostridae - Họ Cà kheo,"American Avocet là một loài chim trong họ Recurvirostridae. Chúng có kích thước trung bình, với chiều dài khoảng 40-50 cm. Chim đực và chim cái có ngoại hình tương đối giống nhau, với mỏ cong về phía trên và dài hơn thân chim. Lông của chúng có màu trắng phía dưới và màu nâu hồng phía trên, đặc biệt là trên cánh và đầu.","American Avocet sinh sống chủ yếu ở Bắc Mỹ, từ Canada đến Mexico. Chúng thường sống ở các vùng đầm lầy, hồ, và bãi cát ven biển. ","Chim ăn chủ yếu các loại động vật nhỏ như côn trùng, giun, ốc, và các loài giáp xác nước ngọt.",Least Concern - Ít quan tâm
16, American Bittern,,Botaurus lentiginosus,Pelecaniformes - Bộ Bồ nông,Ardeidae - Họ Diệc,"American Bittern là một loài chim trong họ Ardeidae. Chúng có kích thước trung bình, với chiều dài khoảng 58-81 cm. Chim có cổ dài, màu nâu đồng, với các vệt và đốm màu nâu sẫm trên lưng và cánh. Mặt trên của đầu có màu nâu sáng với các vạch màu nâu sẫm. Mặt dưới của chim có màu trắng với các đốm nâu sẫm.","American Bittern phân bố rộng khắp ở Bắc Mỹ, từ Alaska và Canada đến miền trung Mexico. Chúng sống trong các môi trường đầm lầy, ao rừng và các khu vực ven nước. ","Chim ăn chủ yếu các loại cá, ếch, giun và các động vật nhỏ khác.",Least Concern - Ít quan tâm
17,American Coot,Sâm cầm,Fulica americana,Gruiformes - Bộ Sếu,Rallidae - Họ Gà nước,"American Coot là một loài chim trong họ Rallidae. Chúng có kích thước trung bình, với chiều dài khoảng 34-43 cm. Chim có màu lông đen toàn bộ, mỏ trắng và chân màu xám. Đặc điểm nổi bật của chúng là một gánh chân lớn trên mặt dưới mỏ, giúp chúng điều hướng trong nước.","American Coot sinh sống rộng rãi ở Bắc Mỹ, từ Canada đến Mexico. Chúng sống chủ yếu ở các vùng nước ngọt như ao, hồ, và đầm lầy. ","Chim ăn chủ yếu các loại thực vật nổi trên mặt nước, như lá, cỏ, và hạt cây.",Least Concern - Ít quan tâm
18,American Dipper,Chim Hét Nước,Cinclus mexicanus,Passeriformes - Bộ Sẻ,Cinclidae - Họ Lội suối,"American Dipper là một loài chim trong họ Cinclidae. Chúng có kích thước trung bình, với chiều dài khoảng 16-21 cm. Chim có lông màu nâu đậm trên lưng và màu trắng phía dưới, với một lớp ngoáy trắng ở cổ và ngực. Mỏ của chúng hơi cong xuống và chân màu xám đen.","American Dipper được tìm thấy chủ yếu ở vùng núi và dòng sông nhanh của Bắc Mỹ, từ Alaska đến Trung Mỹ. Chúng sống trong môi trường nước, thường được tìm thấy ở các suối, sông và thác nước. ","Chim này có khả năng bơi và lặn dưới nước để tìm kiếm thức ăn, gồm côn trùng, giun và các loại động vật nổi như cá trên đáy sông.",Least Concern - Ít quan tâm
19,American Flamingo,Hồng Hạc,Phoenicopterus ruber,Phoenicopteriformes - Bộ Hồng hạc,Phoenicopteridae - Họ Hồng hạc,"American Flamingo là một loài chim trong họ Phoenicopteridae. Chúng có kích thước lớn, với chiều dài trung bình khoảng 120-145 cm và sải cánh lên đến 150-165 cm. Chim có màu lông đỏ hồng tươi, chân màu hồng và mỏ cong xuống. Mặt trên của mỏ có màu đen và mặt dưới có màu hồng.","American Flamingo phân bố chủ yếu ở khu vực Đại Tây Dương, từ Florida và Karibia đến các nước Nam Mỹ như Venezuela và Brasil. Chúng thường sinh sống trong các hệ thống ao, hồ, và vùng đầm lầy mặn. ","Chim ăn chủ yếu các loại tảo và động vật nhỏ như con trùng, ấu trùng và các loại giun.",Least Concern - Ít quan tâm
20,American Goldfinch,Sẻ thông vàng châu Mỹ,Spinus tristis,Passeriformes - Bộ Sẻ,Fringillidae - Họ Sẻ thông,"American Goldfinch là một loài chim trong họ Fringillidae. Chim cái có màu lông xám trên lưng và lưng cổ tay và có màu vàng rực phía dưới. Chim đực có màu lông tương tự, nhưng có các vạch màu đen trên cánh. Mỏ của chúng là mỏ nón hình nón đen và chân màu đen.","American Goldfinch phân bố rộng khắp ở Bắc Mỹ, từ miền nam Canada đến miền nam Mexico. Chúng sống chủ yếu trong các môi trường cỏ ngắn, bãi cỏ và vùng mở với cây cối. ","Chim này ăn chủ yếu các loại hạt cây, như hạt cây cỏ và hạt cây thân gỗ.",Least Concern - Ít quan tâm
21,American kestrel,Cắt Mỹ,Falco sparverius,Falconiformes - Bộ Cắt,Falconidae - Họ Cắt,"American Kestrel là một loài chim trong họ Falconidae. Chúng có kích thước nhỏ, với chiều dài trung bình khoảng 20-30 cm và sải cánh khoảng 50-60 cm. Chim đực có lưng màu xám và cánh có màu cam, trong khi chim cái có lưng màu nâu đậm và cánh có màu nâu với đốm đen. Mặt dưới của cả hai giới đều có màu trắng với vạch nâu.","American Kestrel phân bố rộng khắp ở Bắc Mỹ, từ miền nam Canada đến miền trung Mexico. Chúng sống trong các môi trường đa dạng như cánh đồng, thảo nguyên, vùng mở và các khu vực gần nông thôn. ","Chim này thường ngụy trang trong cây cối hoặc trên cột điện để săn mồi, chủ yếu là các loại côn trùng như chuồn chuồn, châu chấu và động vật nhỏ như chuột và chim nhỏ.",Least Concern - Ít quan tâm
22,American Pipit,Sẻ đồng Bắc Mỹ,Anthus rubescens,Passeriformes - Bộ Sẻ,Motacillidae - Họ Chìa vôi,"American Pipit là một loài chim trong họ Motacillidae. Chúng có kích thước trung bình, với chiều dài khoảng 15-18 cm. Chim có lông màu nâu xám trên lưng và màu trắng phía dưới. Mỏ của chúng hơi cong xuống và chân màu xám. Trong mùa sinh sản, chim đực có màu lông nâu sẫm hơn và có các đốm nâu trên ngực.
","American Pipit phân bố rộng khắp ở Bắc Mỹ, từ vùng cận Bắc Cực đến miền trung Mexico. Chúng thường sống trong các môi trường cỏ ngắn, bãi cỏ và đồng cỏ. ",Chim này thường di chuyển theo đàn trong quá trình di cư và ăn chủ yếu các loại côn trùng và giun.,Least Concern - Ít quan tâm
23,American Redstart,,Setophaga ruticilla,Passeriformes - Bộ Sẻ,Parulidae,American Redstart là một loài chim trong họ Parulidae. Chim đực có màu lông đặc trưng với lưng màu đen hoặc xám đen và đuôi màu da cam hoặc đỏ cam. Chim cái có lưng màu xám nhạt hoặc nâu và đuôi màu vàng cam. Cả hai giới đều có các đốm màu trắng trên cánh và đuôi.,"American Redstart phân bố rộng khắp ở Bắc Mỹ, từ miền nam Canada đến miền nam Mỹ và miền trung Mexico. Chúng thường sinh sống trong các khu rừng, rừng cây thưa và khu vực gần các dòng nước. Chim này di cư xa vào mùa đông và trở về khu vực sinh sản vào mùa hè. ","Chúng ăn chủ yếu các loại côn trùng như chuồn chuồn, con nhộng và bướm.",Least Concern - Ít quan tâm
24,American Robin,Chim cổ đỏ,Turdus migratorius,Passeriformes - Bộ Sẻ,Turdidae - Họ Hoét,"American Robin là một loài chim trong họ Turdidae. Chúng có kích thước trung bình, với chiều dài khoảng 23-28 cm và sải cánh khoảng 31-41 cm. Chim đực và cái đều có lưng màu xám đậm và ngực màu cam đỏ. Chim trống có đầu màu đen với một mảng trắng ở cổ và mắt. Mỏ của chúng màu vàng và chân màu nâu.","American Robin phân bố rộng khắp ở Bắc Mỹ, từ miền nam Canada đến miền trung Mexico. Chúng thường sống trong các môi trường đa dạng như rừng, công viên, khu đô thị và vùng nông thôn. ","Chim này ăn chủ yếu các loại sâu bọ, giun đất, quả và trái cây.",Least Concern - Ít quan tâm
25,American Wigeon,Vịt trời Mỹ,Mareca americana,Anseriformes - Bộ Ngỗng,Anatidae - Họ Vịt,"American Wigeon là một loài chim trong họ Anatidae. Chim đực có bộ lông đặc trưng với đầu màu xám xanh, cổ và ngực màu hồng nâu, và thân dưới màu trắng. Chim cái có màu lông nhạt hơn, với đầu và cổ màu nâu và cơ thể phía dưới màu hồng nâu. Cả hai giới đều có đôi cánh đen nổi bật trong khi bay.","American Wigeon phân bố rộng khắp ở Bắc Mỹ, từ miền bắc Alaska và miền tây Canada đến miền trung Mexico. Chúng thường sống trong các khu vực nước ngọt như hồ, ao, và sông. ","Chim này ăn chủ yếu các loại thực vật nổi trên mặt nước, cỏ nước và hạt.",Least Concern - Ít quan tâm
26,Amethyst Woodstar,Chim ruồi amethyst,Calliphlox amethystina,Apodiformes - Bộ Yến,Trochilidae - Họ Chim ruồi,"Amethyst Woodstar là một loài chim trong họ Trochilidae. Chim đực có màu lông đặc trưng với lưng màu xanh lá cây, cổ và ngực màu amethyst sáng và phần dưới cơ thể màu trắng. Chim cái có màu lông tương tự nhưng không có màu amethyst và có vạch nâu trên cổ và ngực.","Amethyst Woodstar có phân bố tại một số vùng núi ở Nam Mỹ, bao gồm Colombia, Ecuador, Peru và Bolivia. Chúng thường sinh sống trong các khu rừng nhiệt đới đất thấp và vùng rừng rậm vùng núi. ",Chim này chủ yếu ăn mật hoa và sử dụng mỏ dài và cong để hút mật từ các loài hoa nhỏ.,
27, Andean Goose,Ngỗng Andean,Chloephaga melanoptera,Anseriformes - Bộ Ngỗng,Anatidae - Họ Vịt,"Andean Goose là một loài chim trong họ Anatidae. Chim trưởng thành có kích thước trung bình, với chiều dài khoảng 55-75 cm. Lưng và cánh của chúng màu nâu đen, cổ màu nâu đồng và ngực màu trắng với các vằn đen. Chim non có màu lông tương tự nhưng không có vằn đen trên ngực.","Andean Goose phân bố chủ yếu ở các vùng núi của Nam Mỹ, bao gồm các quốc gia như Argentina, Chile, Bolivia và Peru. Chúng thường sống ở các vùng đồng cỏ, thảo nguyên và các hồ nước núi. ","Chim này thường ăn cỏ, cỏ nước, rễ cây và một số loài côn trùng.",Least Concern - Ít quan tâm
28,Andean Lapwing,Chìa vôi Andean,Vanellus resplendens,Charadriiformes - Bộ Cun cút,Charadriidae - Họ Choi choi,"Andean Lapwing là một loài chim trong họ Charadriidae. Chim đực có bộ lông đặc trưng với đầu và ngực màu đen, cổ và cánh màu trắng, và lưng màu xám xanh đen. Chim cái tương tự nhưng có lưng màu nâu hơn và có các vạch trắng trên cổ.","Andean Lapwing phân bố chủ yếu trong khu vực dãy núi Andes ở Nam Mỹ, bao gồm các quốc gia như Peru, Bolivia, Chile và Argentina. Chúng thường sinh sống ở các vùng đồng cỏ và thảo nguyên trên độ cao từ 2.500 m đến 4.500 m. ","Chim này thường ăn cỏ, côn trùng và một số loài thủy sinh.",Least Concern - Ít quan tâm
29,Andean Siskin,,Spinus spinescens,Passeriformes - Bộ Sẻ,Fringillidae - Họ Sẻ thông,"Andean Siskin là một loài chim trong họ Fringillidae. Chim đực có bộ lông đặc trưng với lưng màu xám xanh, đầu và ngực màu vàng và các vạch đen trên cánh. Chim cái có màu lông tương tự nhưng màu vàng không sáng bằng chim đực và có một số đốm đen trên ngực.","Andean Siskin phân bố chủ yếu ở khu vực núi cao trong dãy núi Andes ở Nam Mỹ, bao gồm các quốc gia như Colombia, Ecuador, Peru, Bolivia và Argentina. Chúng thường sống trong các khu rừng núi, khu vực cỏ cây và các vùng cây bụi. ",Chim này thích ăn hạt và thường hình thành đàn nhỏ để tìm kiếm thức ăn.,Least Concern - Ít quan tâm
30,Anhinga,Chim cổ rắn châu Mỹ,Anhinga anhinga,Suliformes - Bộ Chim điên,Anhingidae,"Anhinga là một loài chim trong họ Anhingidae. Chúng có kích thước trung bình với chiều dài khoảng 85-95 cm. Chim trưởng thành có bộ lông màu đen và cổ màu nâu sẫm. Chúng có mỏ dài, nhọn và chân chèo dài giúp chúng điều chỉnh sâu xuống nước khi săn mồi. Chim non có màu lông tương tự nhưng có các vạch vàng trên cổ và ngực.","Anhinga phân bố rộng rãi trong các khu vực nhiệt đới và cận nhiệt đới của châu Phi, châu Mỹ và châu Á. Chúng thường sống gần các khu vực nước ngọt như ao, hồ, sông và vùng đồng cỏ ngập nước. ","Chim này chủ yếu ăn cá và các loài thủy sinh khác, và thường dùng mỏ sắc nhọn để bắt mồi trong nước.",Least Concern - Ít quan tâm
31,Anianiau,,Magumma parva,Passeriformes - Bộ Sẻ,Fringillidae - Họ Sẻ thông,"Anianiau là một loài chim trong họ Fringillidae. Chúng có kích thước nhỏ, với chiều dài khoảng 9-10 cm. Chim trưởng thành có bộ lông màu vàng rực, đầu và lưng màu vàng cam và bụng màu trắng. Chim cái tương tự nhưng có màu lông nhạt hơn và thiếu màu cam ở đầu.","Anianiau phân bố chủ yếu trên đảo Hawaii, thuộc Hoa Kỳ. Chúng sinh sống trong rừng nguyên sinh và khu rừng cao su. ","Chim này thường ăn bao gồm côn trùng, mật hoa và nhựa cây.",Least Concern - Ít quan tâm
