id,common_name,vietnamese_name,scientific_name,bird_order,family,description,distribution,diet,conservation_status
122,California condor,Thần ưng California,Gymnogyps californianus,Cathartiformes,Cathartidae - Họ Kền kền Tân thế giới,"California Condor là một loài chim có kích thước lớn, có cánh dài và đuôi hẹp. Chúng có màu lông chủ yếu là đen, với cổ và đầu trần, mặt trên có màu trắng. Chim trống và chim mái có ngoại hình tương đối giống nhau.","Loài chim này có phạm vi phân bố hạn chế và chỉ được tìm thấy ở một số khu vực tại miền tây Nam Mỹ và Tây Bắc Mỹ, chủ yếu là California và Arizona. Chúng sống trong các khu vực núi cao và thường ưa thích môi trường rừng và vách đá.","California Condor là loài chim ăn xác thối. Chúng thường săn mồi bằng cách tìm kiếm các thi thể động vật chết, như động vật lớn như hươu, hổ, và cá voi. Điều này làm cho chúng trở thành ""rừng rác"" của tự nhiên và có vai trò quan trọng trong việc làm sạch môi trường.",Critically Endangered - Cực kỳ nguy cấp
123,California gull,Mòng biển California,Larus californicus,Charadriiformes - Bộ Cun cút,Laridae - Họ Mòng biển,"California Gull là một loài chim có kích thước trung bình, với đôi cánh dài và mào trắng. Chim trưởng thành có lưng và cánh màu xám, mỏ và chân màu vàng. Chim non có màu lông khác biệt, với lưng màu nâu và lông mày nâu.","Loài chim này có phạm vi phân bố chủ yếu tại miền Tây Bắc và Tây Nam Bắc Mỹ, trong đó California là nơi chủ yếu sinh sống. Chúng thường được tìm thấy ở bãi biển, hồ, và vùng nước ngọt.","California Gull là loài chim ăn tạp, chủ yếu ăn các loài cá, động vật thủy sinh nhỏ, côn trùng, và các nguồn thức ăn khác tìm thấy trên mặt nước hoặc trên đất.",Least Concern - Ít quan tâm
124,California Quail,Cút California,Callipepla californica,Galliformes - Bộ Gà,Odontophoridae - Họ Cút Tân thế giới,"California Quail là một loài chim có kích thước nhỏ, chiều dài khoảng 25-28 cm. Chim đực có màu lông nổi bật với đầu và ngực màu xám xanh, vạch trắng phía trên mắt và lông mào trắng. Chim cái có màu lông nhạt hơn và có vạch trắng dọc trên đầu.","Loài chim này phân bố chủ yếu ở Tây Bắc và Tây Nam Bắc Mỹ, từ miền tây Canada đến miền bắc Mexico. Chúng thường sinh sống trong các khu vực cỏ cây, đồng cỏ, và vùng thảo nguyên.","California Quail ăn hạt, hạt cỏ, hạt cây bụi, cỏ, thân cây, và côn trùng nhỏ.",Least Concern - Ít quan tâm
125,Campo flicker,,Colaptes campestris,Piciformes - Bộ Gõ kiến,Picidae - Họ Gõ kiến,"Chim Campo Flicker là một loài chim thuộc họ Picidae. Chim đực có lưng màu nâu đen với các đốm và vạch màu đen và trắng. Cổ và ngực màu đỏ cam, và bên dưới cơ thể màu trắng. Chim cái có lưng màu nâu đậm với các đốm và vạch màu đen và trắng.","Loài chim này phân bố ở các vùng mở rừng, thảo nguyên và cánh đồng ở Nam Mỹ, bao gồm Argentina, Uruguay, Paraguay, Bolivia và Brasil.","Chúng ăn chủ yếu các loại côn trùng, sâu bọ, hạt và quả.",Least Concern - Ít quan tâm
126,Canary,Chim yến hót,Serinus canaria,Passeriformes - Bộ Sẻ,Fringillidae - Họ Sẻ thông,"Chim Canary là một loài chim có kích thước nhỏ, với chiều dài khoảng 12-13 cm. Chim đực và chim cái có lông màu sặc sỡ, thường được nuôi chọn giống để có các biến thể màu sắc khác nhau. Chim có mỏ nhỏ, chân ngắn và đuôi hình hạt dẻ.","Chim Canary có nguồn gốc từ quần đảo Canary thuộc Tây Phi, nhưng sau đó đã được nuôi và phân bố rộng rãi trên khắp thế giới như một loài chim nuôi với mục đích trang trí và ca hát.","Chế độ ăn của chim Canary bao gồm hạt giống, hạt cỏ, trái cây và thỉnh thoảng côn trùng.",
127,Canvasback,Vịt lặn vai buồm,Aythya valisineria,Anseriformes - Bộ Ngỗng,Anatidae - Họ Vịt,"Chim Canvasback là một loài chim nước lớn, có kích thước trung bình với chiều dài khoảng 48-56 cm. Chim đực có lông màu xám nhạt, đầu và cổ màu đỏ nâu, vàng trên mặt, và mắt đỏ. Chim cái có màu nâu đậm với mắt nâu.","Chim Canvasback phân bố ở Bắc Mỹ, chủ yếu trong khu vực miền Tây và miền Trung của Hoa Kỳ và Canada. Chúng thường sinh sản ở các hồ, ao và vùng đầm lầy nước ngọt.","Chim Canvasback chủ yếu ăn hạt, rễ cây, cỏ và thủy sinh côn trùng. Chúng cũng có thể tìm kiếm thức ăn dưới nước bằng cách lặn xuống và lấy các sinh vật sống trong nước.",Least Concern - Ít quan tâm
128,Cape Glossy Starling,Sáo ngũ sắc Cape,Lamprotornis nitens,Passeriformes - Bộ Sẻ,Sturnidae - Họ Sáo,"Chim Cape Glossy Starling có kích thước trung bình, dài khoảng 20-22 cm. Chim đực có lông màu đen bóng với ánh kim sáng bóng, đặc biệt là trên lưng và cánh. Mỏ và mắt màu vàng sáng. Chim cái có lông tương tự nhưng màu sắc chưa rực rỡ hơn.","Chim Cape Glossy Starling phân bố chủ yếu ở miền Nam và miền Đông châu Phi, bao gồm các nước như Nam Phi, Lesotho, Eswatini và Mozambique. Chúng thường được tìm thấy trong rừng, vùng đồng cỏ và khu vực nông thôn.","Chim Cape Glossy Starling ăn chủ yếu là côn trùng, động vật nhỏ, hạt và trái cây. Chúng cũng có thể ăn các loài sâu bướm, dế mèn, mồi nhỏ và một số nguồn thức ăn thực vật.",Least Concern - Ít quan tâm
129,Cape Longclaw,,Macronyx capensis,Passeriformes - Bộ Sẻ,Motacillidae - Họ Chìa vôi,"Chim Cape Longclaw có kích thước trung bình, dài khoảng 20-23 cm. Chim đực có lông màu vàng cam nổi bật với vạch đen trên cổ, ngực và mặt dưới. Chim cái có lông tương tự nhưng màu sắc nhạt hơn. Chim có mỏ dài và chân dài, và chúng có thể kéo dài và uốn cong mỏ để tìm kiếm con mồi.","Chim Cape Longclaw phân bố chủ yếu ở miền Nam châu Phi, bao gồm các nước như Nam Phi, Lesotho, Eswatini, và một số khu vực ở Zimbabwe và Mozambique. Chúng thường được tìm thấy trong cánh đồng, đồng cỏ và vùng đồng cỏ bị cháy.","Chim Cape Longclaw ăn chủ yếu là côn trùng, bao gồm bọ cánh cứng, ruồi, giun, sâu bướm và các loài côn trùng nhỏ khác. Chúng cũng có thể ăn một số hạt nhỏ và một ít thức ăn thực vật.",Least Concern - Ít quan tâm
130,Cape May Warbler,,Setophaga tigrina,Passeriformes - Bộ Sẻ,Parulidae,"Chim Cape May Warbler có kích thước nhỏ, dài khoảng 11-13 cm. Chim đực có màu sắc rực rỡ với lưng và đỉnh đầu màu xám xanh và ngực và bên trong cánh màu cam sáng, đôi mắt màu đen và mỏ đen. Chim cái và chim non có lông tương tự nhưng màu sắc nhạt hơn.","Chim Cape May Warbler sinh sản ở miền bắc Bắc Mỹ và miền đông Canada, và di cư xuống miền nam Mỹ và Trung Mỹ vào mùa đông. Chúng thường sống trong rừng cây lá kim và rừng cây lá rụng trong suốt mùa sinh sản.","Chim Cape May Warbler chủ yếu ăn côn trùng, bao gồm con trưởng thành và ấu trùng. Chúng cũng có thể ăn một số mật hoa và thức ăn thực vật như trái cây và một số hạt nhỏ.",Least Concern - Ít quan tâm
131,Cape Rock Thrush,,Monticola rupestris,Passeriformes - Bộ Sẻ,Muscicapidae - Họ Đớp ruồi,"Chim Cape Rock Thrush có kích thước trung bình, dài khoảng 19-21 cm. Chim đực trong mùa sinh sản có lưng màu xanh xám và ngực, cổ và mặt màu đen. Chim cái và chim non có lông tương tự nhưng màu sắc nhạt hơn với màu nâu sẫm và nâu xám.","Chim Cape Rock Thrush phân bố rộng rãi ở châu Phi, từ Nam Phi đến Namibia và Botswana. Chúng sống trong môi trường đá và vách đá ở vùng núi, thường tìm kiếm thức ăn trên mặt đất và trên các bức tường đá.","Chim Cape Rock Thrush chủ yếu ăn côn trùng, như kiến, con trưởng thành và ấu trùng. Chúng cũng có thể ăn một số loại trái cây và hạt.",Least Concern - Ít quan tâm
132,Capped Heron,,Pilherodius pileatus,Pelecaniformes - Bộ Bồ nông,Ardeidae - Họ Diệc,Capped Heron là một loài diệc nhỏ với chiều dài khoảng 50-58 cm. Chim trưởng thành có màu xám nhạt trên lưng và màu trắng ở dưới cơ thể. Đầu chim có màu xám đen với một mũ đen tạo nên vẻ ngoài đặc biệt của loài này.,"Capped Heron phân bố ở khu vực Nam Mỹ, từ Colombia và Venezuela đến Argentina. Chúng thường sống ở gần các vùng nước chậm như đầm lầy, ao rừng và sông rừng.","Chủ yếu là ăn cá và động vật thủy sinh như giun, tôm và ếch. Chúng cũng có thể săn các loại côn trùng, động vật không xương sống nhỏ và các loại mực và cua.",Least Concern - Ít quan tâm
133,Capuchinbird,,Perissocephalus tricolor,Passeriformes - Bộ Sẻ,Cotingidae,"Capuchinbird là một loài chim có kích thước lớn, đạt chiều dài khoảng 41-46 cm. Chim trưởng thành có lông màu đen và trên đầu có một mào lông lớn màu đỏ. Chim cái nhỏ hơn và có lông màu nâu sẫm.","Capuchinbird phân bố chủ yếu trong khu vực rừng mưa nhiệt đới ở Nam Mỹ, bao gồm các nước như Colombia, Venezuela, Guyana, Suriname, và French Guiana.","Chúng ăn chủ yếu các loại trái cây, như quả mọng và quả như mâm xôi. Ngoài ra, chúng cũng có thể ăn côn trùng và các loại mồi nhỏ khác.",Least Concern - Ít quan tâm
134,Carmine Bee-eater,,Merops nubicoides,Coraciiformes,Meropidae - Họ Trảu,"Carmine Bee-eater là một loài chim có kích thước trung bình, đạt chiều dài khoảng 17-19 cm. Chúng có bộ lông nổi bật với lưng màu xanh lá cây, ngực màu đỏ thẫm, và một mỏ dài và nhọn. Chim cái có lưng và đuôi màu xanh nhạt hơn và không có màu đỏ trên ngực.","Carmine Bee-eater phân bố ở châu Phi, từ khu vực Sahara phía nam đến Nam Phi và Madagascar. Chúng thường được tìm thấy trong các vùng đồng cỏ, rừng thưa, và khu vực ven sông.","Chúng chủ yếu ăn các loài ong và kiến, cũng như các loại côn trùng bay nhỏ khác. Chúng thường bắt mồi bằng cách bay lượn trên không và hạ cánh để bắt mồi trên mặt đất hoặc từ vị trí cao trên cây.",Least Concern - Ít quan tâm
135,Caspian Tern,Nhàn Caspi,Hydroprogne caspia,Charadriiformes - Bộ Cun cút,Laridae - Họ Mòng biển,"Caspian Tern là một loài chim cỡ lớn, với màu lông trắng và bộ lông xám đen trên lưng. Chúng có mỏ dài và lớn, đuôi dài và chân màu đỏ. Chim trống và chim mái có ngoại hình tương tự nhau.","Caspian Tern phân bố rộng khắp trên toàn thế giới, từ khu vực ven biển của Bắc Băng Dương và Đại Tây Dương, châu Âu, châu Phi, châu Á và châu Mỹ.","Loài chim này chủ yếu săn cá bằng cách lao xuống mặt nước và bắt cá bằng mỏ của mình. Chúng cũng ăn động vật nhỏ khác như ếch, giun, tôm và cua.",Least Concern - Ít quan tâm
136,Cassowary,Đà điểu đầu mào,Casuarius spp,Casuariiformes - Bộ Đà điểu châu Úc,Casuariidae - Họ Đà điểu châu Úc,"Cassowary là loài chim cỡ lớn, có hình dạng giống một loại chim không bay. Chúng có chiều cao khoảng 1,5 đến 2 mét và trọng lượng có thể lên đến 60 đến 70 kg. Lông của cassowary thường có màu đen hoặc nâu sẫm, có một mào dày ở đầu và một mảng da xanh hoặc đỏ ở cổ. Đặc điểm nổi bật của chúng là một cái móng dài, sắc bén ở chân thứ ba của chúng.","Cassowary phân bố chủ yếu ở các vùng rừng nhiệt đới ở miền bắc Australia, New Guinea và các đảo lân cận trong khu vực Thái Bình Dương.","Chúng là loài chim ăn cỏ nhưng cũng ăn thêm các loại quả, hạt và động vật nhỏ như ốc, côn trùng và động vật gặm nhấm như chuột và thỏ.",Endangered - Nguy cấp
137,Cedar Waxwing,,Bombycilla cedrorum,Passeriformes - Bộ Sẻ,Bombycillidae ,"Chim Cedar Waxwing có kích thước trung bình, dài khoảng 14-17 cm. Lông màu xám nhạt trên lưng, mặt bụng trắng và đầu có màu đen với mũi màu đen tạo thành hình mũi tên. Đặc điểm nổi bật của chúng là lông đuôi có màu vàng cam và có một dải màu đỏ rực ở cánh.","Chim Cedar Waxwing phân bố rộng rãi tại Bắc Mỹ, từ miền nam Canada, Hoa Kỳ cho đến Trung Mỹ. Chúng thường sinh sống trong các khu rừng ôn đới, vùng cây bụi và cánh đồng.","Chủ yếu ăn các loại trái cây, quả mọng và một số loại côn trùng nhỏ. Chúng cũng có thể đi săn côn trùng bay trong không khí.",Least Concern - Ít quan tâm
138,Cerulean Warbler,,Setophaga cerulea,Passeriformes - Bộ Sẻ,Parulidae,"Chim Cerulean Warbler có kích thước nhỏ, dài khoảng 11-13 cm. Chim đực có màu xanh nhạt trên lưng và màu xanh da trời tươi sáng trên ngực và phần dưới cơ thể. Chim cái có màu xám xanh nhạt và một chút đốm trắng trên mặt. Đặc điểm nổi bật là một sọc màu đen chạy qua mắt.","Chim Cerulean Warbler sinh sống trong khu vực rừng ôn đới đông bắc của Bắc Mỹ, bao gồm miền đông Canada và miền đông Hoa Kỳ. Chúng di cư đến miền trung và nam Mỹ trong mùa đông.","Chim Cerulean Warbler chủ yếu ăn côn trùng, bao gồm bướm, chuồn chuồn và kiến. Chúng cũng ăn một số loại quả và mật hoa.",Vulnerable -  Bị đe doạ
139,Chara de Collar,,Charadrius collaris,Charadriiformes - Bộ Cun cút,Charadriidae - Họ Choi choi,"Chara de Collar là một loài chim nhỏ với kích thước trung bình, dài khoảng 20-24 cm. Chim đực có màu lông chủ dominante màu nâu sẫm trên lưng và màu trắng sáng trên ngực và phần dưới cơ thể. Đầu chim có màu đen và có một vòng cổ màu trắng rõ nét. Chim cái có màu lông tương tự như chim đực nhưng vòng cổ trắng không rõ nét.","Chara de Collar phân bố ở khu vực Nam Mỹ, bao gồm các nước như Argentina, Bolivia, Brasil, Paraguay và Uruguay. Chúng sinh sống ở các vùng cát, bãi cát và bờ sông trong cả môi trường nước ngọt và mặn.","Chara de Collar ăn chủ yếu các loại côn trùng như con nhộng, con ruồi và sò. Chúng cũng ăn một số loại giun và động vật nhuyễn thể trong môi trường nước.",Least Concern - Ít quan tâm
140,Chattering Lory,,Lorius garrulus,Psittaciformes - Bộ Vẹt,Psittacidae - Họ Vẹt,"Chattering Lory là một loài chim thuộc họ vẹt có kích thước trung bình, dài khoảng 30-32 cm. Chim có màu sắc rực rỡ với lông chủ yếu màu đỏ tươi trên lưng, đầu và cổ, cánh và đuôi màu xanh lá cây và một mảng màu đen trên ngực. Chim cái có lớp lông màu nhạt hơn so với chim đực.","Chattering Lory phân bố tự nhiên ở các vùng nhiệt đới và cận nhiệt đới của Indonesia, bao gồm các đảo như New Guinea, Halmahera và các đảo nhỏ xung quanh.","Chattering Lory chủ yếu ăn hoa, mật, quả và hạt. Chúng thích nghi với các loại thức ăn tự nhiên có sẵn trong môi trường sống của mình.",Vulnerable -  Bị đe doạ
141,Chestnut-bellied Euphonia,,Euphonia pectoralis,Passeriformes - Bộ Sẻ,Fringillidae - Họ Sẻ thông,"Chestnut-bellied Euphonia là một loài chim có kích thước nhỏ, dài khoảng 11-12 cm. Chim đực có lông màu xanh lá cây ở lưng và đầu, ngực và bụng màu nâu hung đỏ, và cánh đen với các điểm trắng. Chim cái có lớp lông màu xanh xám trên lưng và đầu, ngực và bụng màu vàng nhạt.","Chestnut-bellied Euphonia phân bố ở vùng nhiệt đới và cận nhiệt đới của Trung và Nam Mỹ, từ México đến Brasil. Chúng thích nghi với các môi trường rừng nhiệt đới, rừng nguyên sinh và các khu vực cây bụi.","Chestnut-bellied Euphonia ăn chủ yếu các loại trái cây, mật hoa và côn trùng.",Least Concern - Ít quan tâm
142,Chestnut-winged Cuckoo,Chim Khát nước,Clamator coromandus,Cuculiformes - Bộ Cu cu,Cuculidae - Họ Cu Cu,"Chestnut-winged Cuckoo là một loài chim kích thước trung bình, dài khoảng 32-35 cm. Chim trống có đầu và lưng màu xám đen, cổ và ngực màu hung cam. Chim cái có lưng nâu và ngực màu nâu sẫm với các vằn sọc màu trắng.","Chestnut-winged Cuckoo phân bố ở khu vực châu Phi và châu Á, từ phía nam Sahara tới miền đông Trung Quốc và Đông Nam Á. Chúng thích nghi với các môi trường rừng, rừng mưa, cánh đồng và khu vực bãi cỏ.","Chestnut-winged Cuckoo ăn chủ yếu các loại sâu bọ, chuột và các loài động vật nhỏ khác.",Least Concern - Ít quan tâm
143,Chinese Bamboo Partridge,,Bambusicola thoracicus,Galliformes - Bộ Gà,Phasianidae - Họ Trĩ,"Chinese Bamboo Partridge là một loài chim kích thước nhỏ, dài khoảng 25-30 cm. Chim trống có lưng màu nâu đậm với các vằn sọc màu đen, ngực màu nâu đỏ và đầu màu xám với lông trên đầu dựng đứng. Chim cái có lưng nâu sẫm và ngực màu nâu đỏ nhạt.","Chinese Bamboo Partridge phân bố chủ yếu ở Trung Quốc và Đông Nam Á, bao gồm Việt Nam, Lào, Campuchia, và Thái Lan. Chúng thích nghi với các môi trường rừng, rừng tre, và vùng cây cỏ.","Chinese Bamboo Partridge ăn chủ yếu các loại hạt, quả, hạt tre, cỏ và côn trùng nhỏ.",Least Concern - Ít quan tâm
144,Chinese Pond Heron,Cò Bợ,Ardeola bacchus,Pelecaniformes - Bộ Bồ nông,Ardeidae - Họ Diệc,"Chinese Pond Heron là một loài diệc nhỏ, dài khoảng 40-50 cm. Chim trưởng thành có màu lông phổ biến là xanh nhạt trong mùa sinh sản và trắng xám trong mùa không sinh sản. Chim non có lông màu nâu sẫm. Mỏ và chân màu vàng.","Chinese Pond Heron phân bố rộng khắp khu vực từ Đông Á đến Đông Nam Á. Chúng được tìm thấy trong các môi trường nước ngọt như ao, hồ, đầm lầy, và đồng cỏ.","Chinese Pond Heron chủ yếu ăn cá, ếch, cua, tôm và các loại côn trùng nhỏ.",Least Concern - Ít quan tâm
145,Chipping Sparrow,,Spizella passerina,Passeriformes - Bộ Sẻ,Passerellidae - Họ Sẻ Tân Thế giới,"Chipping Sparrow là một loài chim có kích thước nhỏ, dài khoảng 12-15 cm. Chim trưởng thành có màu lông chủ yếu là màu nâu và xám. Đầu chim có màu nâu và mặt có một vệt đen trên mắt. Chim non có màu lông nhạt hơn và thiếu vệt đen trên mặt.","Chipping Sparrow sinh sống chủ yếu ở Bắc Mỹ, từ miền nam Canada đến miền bắc Mexico. Chúng thường được tìm thấy trong rừng cây lá kim, khu vực cỏ cây, vườn và công viên.","Chipping Sparrow ăn chủ yếu các loại hạt và hột cây, bao gồm cả hạt thực phẩm và hạt cây hoang dã. Chúng cũng có thể ăn côn trùng nhỏ và sâu bọ.",Least Concern - Ít quan tâm
146,Chucao Tapaculo,,Scelorchilus rubecula,Passeriformes - Bộ Sẻ,Rhinocryptidae ,"Chucao Tapaculo là một loài chim có kích thước nhỏ, dài khoảng 16-18 cm. Chúng có màu lông đen với một vằn trắng trên cánh và đuôi ngắn. Chim trưởng thành có mỏ dày và chân mạnh, phù hợp để leo trèo trong môi trường rừng.","Chucao Tapaculo sinh sống ở Nam Mỹ, chủ yếu tìm thấy trong các khu rừng ẩm ướt núi cao của Chile và Argentina. Chúng sống ẩn trong cỏ cây dày đặc và tầng cây thấp của rừng.","Chucao Tapaculo ăn chủ yếu côn trùng, nhện và động vật nhỏ khác. Chúng tìm kiếm thức ăn trên mặt đất và trong lớp lá và cỏ cây dày đặc.",Least Concern - Ít quan tâm
147,Chukar Partridge,,Alectoris chukar,Galliformes - Bộ Gà,Phasianidae - Họ Trĩ,"Chukar Partridge là một loài chim có kích thước trung bình, dài khoảng 32-35 cm. Chúng có mỏ ngắn, cánh cụt và đuôi ngắn. Chim trưởng thành có màu lông chủ yếu là màu xám, với một mũi màu đỏ và vạch đen trên lưng.","Chukar Partridge phân bố rộng rãi từ miền trung châu Âu, Trung Đông cho đến khu vực Ấn Độ và Trung Quốc. Chúng sống trong vùng núi và vùng đồng cỏ với địa hình đá và cây bụi.","Chukar Partridge ăn chủ yếu hạt, hạt cỏ, thảo mộc và côn trùng nhỏ. Chúng thường kiếm ăn trên mặt đất và trong vùng cây bụi.",Least Concern - Ít quan tâm
148,Cinnamon Attila,,Attila cinnamomeus,Passeriformes - Bộ Sẻ,Tyrannidae - Họ Đớp ruồi bạo chúa,"Cinnamon Attila là một loài chim có kích thước trung bình, dài khoảng 20-23 cm. Chim trưởng thành có màu lông chủ yếu là nâu và cam, với phần dưới cơ thể có màu cam đậm. Chim đực và chim cái có sự tương đồng về màu sắc.","Cinnamon Attila sinh sống trong các vùng rừng ẩm và khu rừng thưa ở Trung và Nam Mỹ, từ Mexico đến Argentina. Chúng thường được tìm thấy trong tầng cận rừng, gần sông, khu vực có cây bụi và cây cối dày đặc.","Cinnamon Attila chủ yếu ăn côn trùng, như con ruồi, châu chấu, bướm và ong. Chúng thường săn mồi bằng cách bay từ cây sang cây để bắt kịp con mồi.",Least Concern - Ít quan tâm
149,Cinnamon Flycatcher,,Pyrrhomyias cinnamomeus,Passeriformes - Bộ Sẻ,Tyrannidae - Họ Đớp ruồi bạo chúa,"Cinnamon Flycatcher là một loài chim nhỏ, dài khoảng 12-13 cm. Chim trưởng thành có màu lông chủ yếu là nâu cam, có lưng và cánh màu nâu đậm hơn. Chim đực và chim cái có màu sắc tương đồng.","Cinnamon Flycatcher phân bố ở các khu vực rừng, cả rừng mưa nhiệt đới và rừng thưa của Nam Mỹ. Chúng được tìm thấy từ Panama đến Bolivia và Brasil.","Loài chim này chủ yếu ăn côn trùng, như muỗi, ruồi, bướm và kiến. Chúng thường đi săn từ cành cây và cây bụi để bắt kịp con mồi.",Least Concern - Ít quan tâm
150,Cinnamon Teal,,Spatula cyanoptera,Anseriformes - Bộ Ngỗng,Anatidae - Họ Vịt,"Cinnamon Teal là một loài vịt nhỏ, dài khoảng 38-41 cm. Chim trống có màu lông chủ yếu là nâu đỏ, đầu và cổ có màu nâu đen, và cánh có màu xanh lam nhạt. Chim cái có màu lông tương tự nhưng nhạt hơn.","Cinnamon Teal sinh sống ở vùng nước ngọt và đầm lầy của miền tây Bắc Mỹ và Trung Mỹ. Chúng được tìm thấy từ Alaska và Canada đến Trung Mỹ, bao gồm các khu vực như California, Texas, và Mexico.","Loài chim này ăn chủ yếu là hạt, cỏ, và các loại cây nổi trên mặt nước. Chúng cũng có thể săn nhỏ, như côn trùng và động vật thủy sinh nhỏ.",Least Concern - Ít quan tâm
151,Clark's Grebe,,Aechmophorus clarkii,Podicipediformes - Bộ Chim lặn,Podicipedidae - Họ Chim lặn,"Clark's Grebe là một loài chim nước lớn, có kích thước trung bình từ 55 đến 71 cm. Chúng có lông màu trắng trên phần dưới, cổ và mặt có màu đen, và một mảng màu đen trên đỉnh đầu. Mỏ dài và màu xám đen, chân và màng chân có màu xám.","Clark's Grebe sinh sống ở Bắc Mỹ, chủ yếu trong các vùng nước ngọt và đầm lầy của miền Tây Hoa Kỳ và miền Trung Canada. Chúng thường tìm thấy ở các hồ, ao, và sông có nước trong và cung cấp đủ nguồn thức ăn.","Loài chim này chủ yếu ăn cá và các loại động vật thủy sinh nhỏ khác, bao gồm cua, ếch, ấu trùng côn trùng và động vật thủy sinh nhỏ.",Least Concern - Ít quan tâm
